Name;Card Type;Landscape;Ability;Set;Image Path;Cost;Attack;Defense
Ethan Allfire;Creature;Cornfield;When Ethan Allfire leaves play, draw 1 card for each Cornfield Landscape you control.;For The Glory;ethan_allfire.png;1;0;4
10th Anniversary Backer;Hero;;The first time you play a KICKSTARTER card on your turn, reveal the top card of your deck. If it is a KICKSTARTER card, draw it. ;Kickstarter #1;10th_anniversary_backer.png;;;
Abdominal Snowman;Creature;IcyLands;`+3 ATK while your opponent does not control a Creature in this Lane. ;Ice King Vs Marceline;abdominal_snowman.png;1;3;2
AbneGator;Creature;Useless Swamp;If this card is discarded from your hand or deck during your turn, gain 1 action. If it is discarded during an opponent's turn, draw a card instead. ;Kickstarter #2;abnegator.png;1;3;4
Abraca Amadeus;Spell;Useless Swamp;Target opponent discards a card from their hand for every 5 cards in your discard pile. ;BMO Vs Lady Rainicorn;abraca_amadeus.png;2;;
Abracadaniel;Hero;;Pay 1 Action >>> Reveal the top card of your deck. If it's a Rainbow card, play it. ;Hero Pack;abracadaniel.png;;;
Absorb Aether;Spell;Useless Swamp;Deal 3 damage to a Creature and heal 3 HP. Repeat this effect for each player with 1 or fewer cards in hand. ;Land of Legends;absorb_aether.png;1;;
Adorabunny;Creature;NiceLands;At the start of your turn, if Adorabunny has 4 or more damage on it, deal 3 damage to target opponent. ;Doubles Tournament;adorabunny.png;1;0;8
Adored Cobnoblin;Creature;Cornfield;Gobble. FLOOP >>> Reduce the cost of the next Creature you play by 1. ;Flame Princess Vs Fern;adored_cobnoblin.png;1;1;4
Aeromancer;Creature;Blue Plains;When Aeromancer enters play, you may swap the positions of 2 Creatures target player controls. ;Doubles Tournament;aeromancer.png;2;3;5
Albino Eyebat;Creature;NiceLands;While Albino Eyebat has exactly 2 damage on it, it has +2 ATK. ;Princess Bubblegum Vs Lumpy Space Princess;albino_eyebat.png;1;2;7
Amaizing Avalanche;Spell;Cornfield;Each of your Creatures has +1 ATK this turn for each facedown Landscape in play. ;Lemon Grab Vs Gunter;amaizing_avalanche.png;1;;
Ancient Comet;Spell;Rainbow;Flip a coin. If heads, deal 2 damage to each of your Creatures. If tails, your Creatures get +2 ATK this turn. ;Kickstarter #1;ancient_comet.png;0;;
Ancient Healer;Creature;Blue Plains;If Ancient Healer is played on a facedown Landscape, turn it face up and heal 4 HP.;Kickstarter #1;ancient_healer.png;1;1;6
Ancient Magic Pharaoh Dragon;Creature;SandyLands;When Ancient Magic Pharaoh Dragon enters or leaves play, shuffle your discard pile and swap it with your deck. ;Land of Legends;ancient_magic_pharaoh_dragon.png;2;6;6
Ancient Scholar;Creature;Blue Plains;FLOOP >>> Return a random Rainbow card from your discard pile to your hand. If you control a Building in this Lane, gain 1 Action.;Finn Vs Jake;ancient_scholar.png;1;1;7
Angel Heart;Creature;Rainbow;While Angel Heart has exactly 3 damage on it, it has +3 ATK. ;Princess Bubblegum Vs Lumpy Space Princess;angel_heart.png;0;0;7
Angel of Chocolate;Creature;NiceLands;Pay 1 Action >>> Heal all damage from Angel of Chocolate. ;Princess Bubblegum Vs Lumpy Space Princess;angel_of_chocolate.png;2;3;7
Angel of Vanilla;Creature;NiceLands;Pay 1 Action >>> Heal all damage from Angel of Vanilla. ;Princess Bubblegum Vs Lumpy Space Princess;angel_of_vanilla.png;1;2;6
Apple Bully;Creature;Cornfield;Apple Bully's Landscape cannot be flipped face down by opponents.;For The Glory;apple_bully.png;2;3;8
Apple Pieclops;Creature;NiceLands;At the start of your turn, you may heal or deal 1 damage to each of your Creatures. (Choose for each Creature.);Princess Bubblegum Vs Lumpy Space Princess;apple_pieclops.png;2;1;7
Archer Dan;Creature;Cornfield;FLOOP >>> Destroy target Building in Archer Dan's Lane. ;Finn Vs Jake;archer_dan.png;2;2;6
Archer Danica;Creature;Cornfield;FLOOP and destroy a Building you control >>> Deal 3 damage to each opposing Creature.;Fionna Vs Cake;archer_danica.png;2;1;6
Arctic Purge;Spell;IcyLands;Draw 2 cards. You may remove a non-damage token from a Creature or Landscape. If you do, your opponent discards a card.;Land of Legends;arctic_purge.png;1;;
Ascension Silo;Building;Cornfield;Once per turn, when your Creature in this Lane leaves play, draw 1 card. ;Flame Princess Vs Fern;ascension_silo.png;1;;
Ashcloud;Spell;LavaFlats;Deal 2 damage to target opposing Creature and each opposing Creature in adjacent Lanes. ;Land of Legends;ashcloud.png;1;;
Assistance;Teamwork;SandyLands;At the start of your or your teammate's Fight Phase, if you or your teammate played a Creature with cost 2 or greater this turn, the other teammate may draw a card.;Doubles Tournament;assistance.png;1;;
Auto-Plucker;Building;NiceLands;FLOOP >>> Heal or deal 1 damage to your Creature in this Lane.;Ice King Vs Marceline;auto-plucker.png;1;;
Axolotl;Creature;Rainbow;FLOOP >>> Target player heals 3 HP. ;Peppermint Butler Vs Magic Man;axolotl.png;1;1;5
Baby Finn & Jake;Hero;;Your deck cannot contain Creatures with more than 3 ATK. At the start of your Fight Phase, choose one of your Creatures. That Creature has +3 ATK this turn. ;Kickstarter #2;baby_finn_&_jake.png;;;
Bail Out;Spell;SandyLands;Put target Creature you own into your hand, then play it for free. ;Doubles Tournament;bail_out.png;1;;
Bale Out;Spell;Cornfield;When target Creature attacks this turn, if it would leave play during the Fight Phase, remove all damage from it instead. ;Doubles Tournament;bale_out.png;1;;
Ban-She Princess;Creature;Useless Swamp;When Ban-She Princess enters play, you may remove a token from an adjacent Landscape. ;Ice King Vs Marceline;ban-she_princess.png;1;2;7
Ban-She Queen;Creature;Useless Swamp;When Ban-She Queen enters play, you may remove a token from an adjacent Landscape. ;Ice King Vs Marceline;ban-she_queen.png;2;3;9
Banana Man;Hero;;Once per turn, you may peek at the bottom card of your deck and either discard it or put it on top of your deck. ;Kickstarter #2;banana_man.png;;;
Barrow Baron;Creature;Useless Swamp;Barrow Baron costs 1 less to play for every 5 cards in an opponent's discard pile. ;Prismo Vs The Lich;barrow_baron.png;3;5;12
Basalt Behemoth;Creature;LavaFlats;FLOOP >>> Burn an opposing Creature, then deal 1 damage to that Creature for each burn token on Creatures in play. ;Land of Legends;basalt_behemoth.png;2;1;12
Bayou Boa;Creature;Useless Swamp;Destroy a Creature you control >>> Put 2 :attack_token: on Bayou Boa and heal 2 damage from it.;Land of Legends;bayou_boa.png;2;2;12
Bayou Fountain;Building;Useless Swamp;Discard a card >>> Your Creature in this Lane has +1 ATK this turn. ;Doubles Tournament;bayou_fountain.png;1;;
Bayou Surge;Spell;Useless Swamp;Destroy all Creatures in a Lane. Starting with you, each player may put a Creature from their hand into play on a Landscape they control in that Lane. ;Kickstarter #2;bayou_surge.png;2;;
Beach Ball;Spell;Rainbow;Gain 4 HP. Draw a card. You may put this into an opponent's hand. If you do, draw another card. (You may only play 1 Beach Ball per turn.) ;Kickstarter #1;beach_ball.png;0;;
Beach Blast;Spell;Rainbow;Reveal the top 3 cards of your deck. Draw 1 card and discard the rest. After playing this, you may put it into your teammate's hand. ;Doubles Tournament;beach_blast.png;1;;
Beach Mummy;Creature;SandyLands;FLOOP >>> Return a Creature in an adjacent Lane to its owner's hand. ;BMO Vs Lady Rainicorn;beach_mummy.png;1;1;6
Beach Worm;Creature;SandyLands;When Beach Worm enters play, if you control Creatures of 4 different Landscape types, you may destroy target opposing Creature. ;Land of Legends;beach_worm.png;1;4;4
Bean Ball Bomba;Building;NiceLands;FLOOP >>> Heal or deal damage to your Creature in this Lane until it has 4 damage on it. ;Doubles Tournament;bean_ball_bomba.png;2;;
Berserk Bakery;Building;Cornfield;Once during your turn, you may discard a card from your hand to put a damage token on Berserk Bakery. FLOOP >>> Deal 1 damage to the opposing Creature in this Lane for each token on this. ;Kickstarter #1;berserk_bakery.png;2;;
Betty;Hero;;Your minimum deck size is +5. Begin the game with 5 different 1-cost Spells removed from your deck. Set them aside. These are your Research Notes. Pay 1 action >>> Reveal a random card from your Research Notes and play it for free. (Limit: Once per turn.);Kickstarter #2;betty.png;;;
Big Foot;Creature;Rainbow;FLOOP >>> Flip target facedown Landscape you control face up. ;Finn Vs Jake;big_foot.png;0;1;4
Billy;Hero;;If your opponent's deck runs out of cards, you win the game. ;Hero Pack;billy.png;;;
Biomancer;Creature;Blue Plains;Whenever one of your Creatures changes Lanes, heal 2 damage from Biomancer. ;Doubles Tournament;biomancer.png;1;1;8
Bitterchill Avalancheetah;Creature;IcyLands;When Bitterchill Avalancheetah damages an opponent, they must discard a Spell or reveal a hand with none. ;Prismo Vs The Lich;bitterchill_avalancheetah.png;2;3;8
Black Hole Pendant;Spell;Rainbow;Target Creature has +X ATK this turn, where X is the number of different Landscape types your opponent controls. ;Ice King Vs Marceline;black_hole_pendant.png;0;;
Black Paladin;Creature;Useless Swamp;`+1 ATK for each card any player has discarded from their hand this turn. ;For The Glory;black_paladin.png;1;1;7
Bladespire Maelstrom;Spell;Rainbow;Remove all non-damage tokens from Creatures, Landscapes, and players. Then deal 2 damage to target Creature for each token removed. ;Peppermint Butler Vs Magic Man;bladespire_maelstrom.png;1;;
Blizzard Born;Creature;IcyLands;When Blizzard Born enters play, freeze all Landscapes you and target opponent control. You may play Creatures onto frozen Landscapes.;Kickstarter #2;blizzard_born.png;2;6;5
Blizzardpaw Avalancheetah;Creature;IcyLands;When Blizzardpaw Avalancheetah enters play, draw 2 cards unless another player freezes one of their unfrozen Landscapes. ;Prismo Vs The Lich;blizzardpaw_avalancheetah.png;1;3;2
Blonde MerWitch;Creature;Rainbow;;BMO Vs Lady Rainicorn;blonde_merwitch.png;2;3;9
Blood Bath;Spell;Useless Swamp;Target opponent may discard a card with cost 2 or greater. If they do not, deal 5 damage to them. ;Ice King Vs Marceline;blood_bath.png;2;;
Blood Castle;Building;Rainbow;Each time an opposing Creature in this Lane takes damage, increase the amount by 1. ;Fionna Vs Cake;blood_castle.png;1;;
Blood Fortress;Building;Rainbow;Your Creature in this Lane has +1 ATK. ;Finn Vs Jake;blood_fortress.png;1;;
Blood Transfusion;Spell;Rainbow;Remove a card in any player's discard pile from the game. Heal target Creature X damage, where X is the cost of the removed card. ;Ice King Vs Marceline;blood_transfusion.png;0;;
Blue Candy;Spell;NiceLands;Heal up to 3 damage from target Creature you control. ;Princess Bubblegum Vs Lumpy Space Princess;blue_candy.png;1;;
Blue Gnome;Creature;Blue Plains;FLOOP >>> Deal 1 damage to each opposing Creature that is on a Useless Swamp Landscape. ;For The Glory;blue_gnome.png;1;1;6
Blue Merlock;Creature;Useless Swamp;FLOOP >>> Draw a card, then discard a card. ;For The Glory;blue_merlock.png;1;2;5
Blue Ogre;Creature;Blue Plains;Whenever you draw a card, Blue Ogre has +1 ATK this turn. ;For The Glory;blue_ogre.png;2;1;5
Blue Plains Drifter;Creature;Blue Plains;Once per turn, you may swap Lanes with another one of your Creatures. Both Creatures have +1 ATK this turn. ;Promo;blue_plains_drifter.png;1;1;6
Blue Slimey;Creature;Blue Plains;If you control 3 or more different Landscape types when Blue Slimey enters play, return a Creature in this Lane to its owner's hand. ;For The Glory;blue_slimey.png;1;2;6
Blueberry Djinni;Creature;Blue Plains;If Blueberry Djinni replaces a Creature, draw 2 cards. ;Princess Bubblegum Vs Lumpy Space Princess;blueberry_djinni.png;1;2;6
Blueberry Pieclops;Creature;Blue Plains;Blueberry Pieclops costs 1 less to play for each Spell you have played this turn. ;For The Glory;blueberry_pieclops.png;4;5;6
BMO;Hero;;Discard a card from your hand >>> Deal 1 Damage to target Creature. ;BMO Vs Lady Rainicorn;bmo.png;;;
Boarder Collie;Creature;IcyLands;FLOOP >>> Move Boarder Collie to any of your empty Landscapes. If either Landscape in that Lane is frozen, gain 1 Action. ;Ice King Vs Marceline;boarder_collie.png;1;1;7
Bog Ban-She Angel;Creature;Useless Swamp;Pay 1 Action >>> Move all damage on this Creature to target Creature. ;Ice King Vs Marceline;bog_ban-she_angel.png;2;2;7
Bog Bum;Creature;Useless Swamp;If Bog Bum leaves play while ready, each opponent discards a random card. ;Ice King Vs Marceline;bog_bum.png;1;2;6
Bog Cyclone;Spell;Useless Swamp;Shuffle your discard pile. Put 2 random cards from it into your hand and the rest on the bottom of your deck. Then remove this card from the game. ;Kickstarter #2;bog_cyclone.png;1;;
Bog Eyesnek;Creature;Useless Swamp;"When Bog Eyesnek enters play, deal 1 damage to target opponent and heal 1 HP for each Creature in play with ""Eyesnek"" in its name. ";Land of Legends;bog_eyesnek.png;1;1;9
Bog Frog Bomb;Creature;Useless Swamp;If Bog Frog Bomb leaves play while ready, deal 2 damage to each opposing Creature. ;Ice King Vs Marceline;bog_drog_bomb.png;2;3;8
Bog Palace;Building;Useless Swamp;Your Creature in this Lane has +3 ATK. At the start of each of your turns, discard a card. ;Doubles Tournament;bog_palace.png;2;;
Bomb Pop;Spell;IcyLands;Destroy target Creature on a frozen Landscape. ;Doubles Tournament;bomb_pop.png;1;;
Bone Wand;Spell;Rainbow;Play only if you control a Useless Swamp Creature. Target opponent discards a card from their hand. ;BMO Vs Lady Rainicorn;bone_wand.png;0;;
Bongo Bounce House;Building;SandyLands;When you are dealt damage, deal that damage to Bongo Bounce House instead. ;Kickstarter #1;bongo_bounce_house.png;2;;8
Bottlebeard, the Cool;Creature;SandyLands;"When Bottlebeard enters play, you may put up to 2 cards with ""Potion"" in their name into your hand from your discard pile. ";Peppermint Butler Vs Magic Man;bottlebeard,_the_cool.png;2;3;7
Bouncing Zebracorn;Creature;Cornfield;`+1 ATK for each different Landscape type you control. ;Lemon Grab Vs Gunter;bouncing_zebracorn.png;2;1;9
Boxing Day;Spell;Rainbow;Put an :attack_token: on each friendly Creature. ;Peppermint Butler Vs Magic Man;boxing_day.png;1;;
Brain Gooey;Creature;Blue Plains;If Brain Gooey replaces a Creature, it has +2 ATK this turn. ;Princess Bubblegum Vs Lumpy Space Princess;brain_gooey.png;1;1;7
Brainblades;Spell;Blue Plains;Put an :attack_token: on target Creature. Give it an additional :attack_token: for each other card in your hand. ;Land of Legends;brainblades.png;2;;
Brew Haha;Creature;NiceLands;"When Brew Haha enters play, search your deck for a card with ""Potion"" in its name. Play it for free and shuffle your deck. ";Land of Legends;brew_haha.png;2;4;3
Brief Power;Spell;Rainbow;Target Useless Swamp Creature you control has +2 ATK this turn. ;Princess Bubblegum Vs Lumpy Space Princess;brief_power.png;0;;
Brigadier Banana Split;Creature;IcyLands;When Brigadier Banana Split attacks, deal 2 damage to target opposing Creature on a frozen Landscape. ;Doubles Tournament;brigadier_banana_split.png;2;3;9
Brightheart Nexus;Building;NiceLands;When you play a Spell, heal 1 damage from friendly Creatures in this Lane. If you have no Creatures in this Lane, target player gains 1 HP instead. ;Peppermint Butler Vs Magic Man;brightheart_nexus.png;1;;
Brilliant Discovery;Spell;Rainbow;Draw 2 cards. You may shuffle up to 2 Spells from your discard pile into your Research Notes. ;Kickstarter #2;brilliant_discovery.png;1;;
Brilliant Flare;Spell;LavaFlats;Draw 5 cards. At end of turn, discard all but 1 card. ;Peppermint Butler Vs Magic Man;brilliant_flare.png;1;;
"
Broils Coils";Spell;LavaFlats;Deal 3 damage to target Creature. If a Creature is destroyed this way, gain 1 action. ;Flame Princess Vs Fern;broils_coils.png;1;;
Broog Rider;Creature;Cornfield;When Broog Rider leaves play, put an :attack_token: on your Creatures with cost 1. ;Prismo Vs The Lich;broog_rider.png;1;3;3
Bulkunai, the Leech;Creature;Useless Swamp;Discard a card >>> Heal 3 damage from Bulkunai. (Limit: Once per turn.) ;Peppermint Butler Vs Magic Man;bulkunai,_the_leech.png;2;4;9
Bull Sigil;Spell;Rainbow;Put an :attack_token: on target Creature. If the Creature has 2 or more :attack_token: on it, you may draw a card. ;Peppermint Butler Vs Magic Man;bull_sigil.png;0;;
Bums Away!;Spell;Useless Swamp;Target opponent may discard a card. If they do not, deal 2 damage to each of their Creatures. ;Ice King Vs Marceline;bums_away.png;1;;
Burly Lumberjack;Creature;Cornfield;You may play additional Buildings in this Lane. ;Fionna Vs Cake;burly_lumberjack.png;2;2;9
Business Dog;Creature;Blue Plains;"+2 ATK for each card you have played with ""Dog"" or ""Puppy"" in its title this turn. ";Fionna Vs Cake;business_dog.png;1;1;6
Buttering Ram;Spell;Cornfield;Exhaust any number of Creatures you control. Deal 2 damage to target opponent for each Creature you exhausted this way. ;Land of Legends;buttering_ram.png;1;;
Cabin of Many Woods;Building;Cornfield;Cabin of Many Woods costs 1 less to play for each Flooped Creature you control. Your Creature in this Lane has +5 DEF. ;Fionna Vs Cake;cabin_of_many_woods.png;5;;
Cactus Thug;Creature;SandyLands;Adjacent Cornfield Creatures have +1 ATK. ;For The Glory;cactus_thug.png;1;2;7
Cake;Hero;;Each time a Building enters play under your control, heal 2 Damage from each Creature you control with a Building on its Landscape. ;Fionna Vs Cake;cake.png;;;
Camaraderie;Teamwork;IcyLands;Each time an opposing Creature deals damage to your team, deal 1 damage to the opposing team. ;Doubles Tournament;camaraderie.png;2;;
Camp Kernel;Spell;Cornfield;Your Creatures with cost 1 in this Lane have +1 ATK and +1 DEF. ;Prismo Vs The Lich;camp_kernel.png;1;;
Canopic, the Ceremonial;Creature;NiceLands;When Canopic enters play, put a Spell from your discard pile on top of your deck. ;Peppermint Butler Vs Magic Man;canopic,_the_ceremonial.png;1;3;4
Captain Taco;Creature;Cornfield;When Captain Taco enters play, deal 1 damage to each Creature that is not on a Cornfield Landscape. ;For The Glory;captain_taco.png;1;1;1
Cardboard Mansion;Building;Useless Swamp;Cardboard Mansion costs 1 less to play for every 5 cards in your discard pile. FLOOP >>> Gain 1 Action. ;Ice King Vs Marceline;cardboard_mansion.png;5;;
Careful Shuffle;Spell;Cornfield;Choose a letter of the alphabet, then reveal the top 3 cards of your deck. Put all cards with names that begin with the chosen letter into your hand and discard the rest. ;Kickstarter #2;careful_shuffle.png;0;;
Carmel Camel;Creature;SandyLands;When a Creature you own leaves play, you may put it underneath this card instead. +1 ATK and +1 DEF for each card under this. When this card leaves play, discard all cards under it. ;Lemon Grab Vs Gunter;carmel_camel.png;1;0;4
Carrier Crab;Creature;Rainbow;When Carrier Crab enters play, you may play a card with cost 1 for free. ;Prismo Vs The Lich;carrier_crab.png;2;3;8
Cave of Solitude;Building;NiceLands;Discard a card >>> Your Creature in this Lane cannot be targeted or attacked until the start of your next turn.;Princess Bubblegum Vs Lumpy Space Princess;cave_of_solitude.png;2;;
Celestial Castle;Building;Rainbow;Your Creature in this Lane has +3 DEF. ;Finn Vs Jake;celestial_castle.png;1;;
Celestial Fortress;Building;Rainbow;The opposing Creature in this Lane has -2 DEF. ;Fionna Vs Cake;celestial_fortress.png;1;;
Cerebral Blood Pact;Spell;Rainbow;Put this under a friendly creature. After a creature attacks, it takes damage equal to this creatures attack. Whenever your 'Cerebral Bloodstorm' deals damage, increase it by 2.;Custom Community Cards;cerebral_blood_pact.png;1;;
Cerebral Bloodstorm;Spell;Rainbow;Deal 1 Damage to each opposing Creature. ;Finn Vs Jake;cerebral_bloodstorm.png;1;;
Cerebral Imp;Creature;Useless Swamp;When Cerebral Imp enters play, you may discard a card to play Cerebral Bloodstorm from your discard pile for free. ;Custom Community Cards;cerebral_imp.png;0;2;4
Cerulean Eyesnek;Creature;Blue Plains;"When Cerulean Eyesnek enters play, each player draws a card for each Creature they control with ""Eyesnek"" in its name. ";Land of Legends;cerulean_eyesnek.png;1;3;3
Chalice, the Cruel;Creature;SandyLands;After you play a Spell, deal 2 damage to an opposing Creature. ;Peppermint Butler Vs Magic Man;chalice,_the_cruel.png;2;3;11
Chameleon;Creature;Rainbow;When you play Chameleon, choose its Landscape type. ;Prismo Vs The Lich;chameleon.png;0;2;2
Champion's Emblem;Spell;NiceLands;Heal 3 damage from target Creature. If that Creature still has damage on it, gain 1 action. ;Flame Princess Vs Fern;champion's_emblem.png;1;;
Chancellor's Commended;Creature;Cornfield;When Chancellor's Commended enters play, choose a letter of the alphabet. Other Creatures you control whose names begin with the chosen letter have +3 ATK. ;Kickstarter #2;chancellor's_commended.png;2;3;10
Charlie;Hero;;Once during your turn, you may move a Creature you control to an adjacent empty Landscape. ;Doubles Tournament;charlie.png;;;
Charming City;Building;Blue Plains;All Creatures in this Lane lose their Landscape type and become Rainbow Creatures. ;Fionna Vs Cake;charming_city.png;1;;
Cheat Sheet;Spell;Rainbow;"Draw a card. The next 2 cards you play with ""Potion"" in their name cost 1 less this turn. ";Peppermint Butler Vs Magic Man;cheat_sheet.png;1;;
Cherished Cobnoblin;Creature;Cornfield;Gobble. FLOOP >>> Remove 1 or 2 non-damage tokens from target Creature. Then, place that many :attack_token: on target friendly Creature. ;Flame Princess Vs Fern;cherished_cobnoblin.png;2;3;4
Chest Burster;Creature;Useless Swamp;At the start of your turn, deal 3 damage to each opponent who has no cards in hand. ;BMO Vs Lady Rainicorn;chest_burster.png;1;1;10
Chillwave;Spell;IcyLands;Deal 1 damage to each opposing Creature for each non-damage token on that Creature. Chillwave deals double damage to Creatures on frozen Landscapes. ;Land of Legends;chillwave.png;0;;
Chivalrous Armourdillo;Creature;NiceLands;When Chivalrous Armourdillo enters play, you may heal 3 damage from another Creature. If that Creature still has damage on it, draw a card. ;Flame Princess Vs Fern;chivalrous_armourdillo.png;1;1;6
Chocolate TaCody;Creature;IcyLands;At the start of your Fight Phase, if any Landscape in this Lane is frozen, deal 1 damage to each Creature target player controls. ;Doubles Tournament;chocolate_tacody.png;2;2;7
Choose Goose;Hero;;At the start of the game, choose a letter of the alphabet. The first card you play each turn with a name that starts with your chosen letter costs 1 less. ;Kickstarter #2;choose_goose.png;;;
Chronomancer;Creature;Blue Plains;Each time Chronomancer changes Lanes, gain 1 Action. ;Doubles Tournament;chronomancer.png;2;3;6
Cinder Construct;Creature;LavaFlats;While you have 1 or fewer cards in your hand, damage dealt to Cinder Construct is reduced by half (rounded up). ;Land of Legends;cinder_construct.png;1;3;5
Cinnamon Bun;Hero;;Once during your turn, you may deal 2 Damage to one of your Creatures and gain 2 HP. ;Kickstarter #1;cinnamon_bun.png;;;
Clampire, Sanguine Shell;Creature;Rainbow;When Clampire attacks, heal 1 damage from a friendly Creature. ;Prismo Vs The Lich;clampire,_sanguine_shell.png;1;1;5
Clone;Spell;Rainbow;Play your next Creature or Building for free if a Creature or Building with that name is in play. ;Doubles Tournament;clone.png;0;;
Cloud Tower;Building;Blue Plains;Your Creature in this Lane cannot be targeted by your opponent's Spells or Creature abilities. FLOOP >>> Move a Creature you control to your Landscape in this Lane. ;Doubles Tournament;cloud_tower.png;2;;
Cob Keep;Building;Cornfield;Cob Keep is free to play if any player has 1 or fewer cards in hand. Your Creature in this Lane has +2 ATK and +2 DEF. ;Land of Legends;cob_keep.png;2;;
Cobnoblify;Spell;Rainbow;Give a Creature Gobble this turn. (If that Creature is replaced this turn, put it under the Creature that replaced it. The new Creature gains its ATK, DEF, and any tokens on it, including damage.) ;Land of Legends;cobnoblify.png;1;;
Cold Soldier;Creature;IcyLands;`+3 ATK while your opponent does not control a Creature in this Lane. ;Ice King Vs Marceline;cold_soldier.png;1;2;4
Coldclaw Avalancheetah;Creature;IcyLands;When Coldclaw Avalancheetah enters play, freeze an opponent's Landscape. When a frozen token is removed from any Landscape, heal all damage from Coldclaw Avalancheetah. ;Prismo Vs The Lich;coldclaw_avalancheetah.png;2;3;10
Collaboration;Teamwork;Rainbow;The first time you or your teammate play a Rainbow Spell during their turn, the other teammate may play a Rainbow Spell with the same cost for free. ;Doubles Tournament;collaboration.png;1;;
Combatarium;Building;Blue Plains;FLOOP >>> Ready a Creature in this Lane, then deal 1 damage to it. ;Land of Legends;combatarium.png;1;;
Communication;Teamwork;Rainbow;The first time you or your teammate plays a Rainbow Spell with cost 0 during their turn, the other teammate may copy it and may choose new targets. ;Doubles Tournament;communication.png;1;;
Community Forge;Building;LavaFlats;All Creatures in this Lane have +2 ATK. ;Peppermint Butler Vs Magic Man;community_forge.png;1;;
Confectionary Ring;Spell;NiceLands;Each of your Creatures has +2 ATK this turn while attacking a Creature that is on a Cornfield Landscape. ;For The Glory;confectionary_ring.png;1;;
Conflagration;Spell;LavaFlats;Deal 1 damage to each opposing Creature for each burn token on that Creature. Draw a card. ;Land of Legends;conflagration.png;1;;
Contribution;Teamwork;Blue Plains;At the start of your or your teammate's Fight Phase, if you or your teammate drew 3 or more cards this turn, the other teammate may draw a card. ;Doubles Tournament;contribution.png;1;;
