Name;Card Type;Landscape;Ability;Set;Image Path;Cost;Attack;Defense
Galeblade Tornado;Spell;Blue Plains;Return target friendly Creature to its owner's hand. Return target opposing Creature to its owner's hand. ;Prismo Vs The Lich;galeblade_tornado.png;1;;
Gallant Armourdillo;Creature;NiceLands;When Gallant Armourdillo replaces a Creature, play the top card of your deck for free. ;Flame Princess Vs Fern;gallant_armourdillo.png;2;3;9
Genteel Armourdillo;Creature;NiceLands;Whump. When an opposing Creature attacks, you may choose to have it attack Genteel Armourdillo instead. ;Flame Princess Vs Fern;genteel_armourdillo.png;3;3;14
Gentle Cobnoblin;Creature;Cornfield;Gobble. Gentle Cobnoblin cannot attack (but may defend). ;Land of Legends;gentle_cobnoblin.png;2;4;5
Geomancer;Creature;Blue Plains;At the start of your turn, you may move Geomancer to an empty Landscape you control. ;Doubles Tournament;geomancer.png;1;2;6
Geyser Cannon;Building;LavaFlats;While you have 1 or fewer cards in your hand, double the ATK of friendly Creatures in this Lane. ;Land of Legends;geyser_cannon.png;1;;
Ghost;Creature;Rainbow;`+2 ATK while defending against a Creature that is on a Useless Swamp Landscape. ;For The Glory;ghost.png;0;1;4
Ghost Chest Burster;Creature;Useless Swamp;When Ghost Chest Burster leaves play, draw the bottom card of your deck. ;For The Glory;ghost_chest_burster.png;1;1;9
Ghost Hag;Creature;Rainbow;`+2 ATK while defending against a Creature that is on a Blue Plains Landscape. ;For The Glory;ghost_hag.png;0;1;4
Ghost Ninja;Creature;Blue Plains;When Ghost Ninja deals damage to an opposing player, they cannot play Spells during their next turn. ;For The Glory;ghost_ninja.png;1;2;7
Ghost Princess;Hero;;Chose any number of players to put 3 random cards from their discard pile into their hand, revealing any Creatures. For each one, they heal 2 HP. Finally, they shuffle their discard piles into their decks. (Limit: Once per game.) ;Kickstarter #2;ghost_princess.png;;;
Ghost Sorceress;Creature;Blue Plains;After you play your first Spell each turn, draw 2 cards, then discard 1 card. ;Land of Legends;ghost_sorceress.png;2;3;7
Ghost Tree;Creature;Rainbow;`+2 ATK while defending against a Creature that is on a Cornfield Landscape. ;For The Glory;ghost_tree.png;0;1;4
Giant Mummy Hand;Creature;SandyLands;FLOOP >>> Deal 1 damage to target Creature for each Cornfield Landscape adjacent to this Lane. ;For The Glory;giant_mummy_hand.png;1;0;7
Giant Red Salamander;Creature;LavaFlats;;Flame Princess Vs Fern;giant_red_salamander.png;1;4;3
Giddy Giraffe;Creature;NiceLands;While Giddy Giraffe has 4 or more damage on it, it targets your opponent instead of the opposing Creature. ;Doubles Tournament;giddy_giraffe.png;1;1;8
Glacial Drift;Spell;IcyLands;Move target friendly Creature to an empty Lane. Freeze an opposing Landscape in that Lane. ;Prismo Vs The Lich;glacial_drift.png;1;;
Glacier Racer;Creature;IcyLands;`+4 ATK if both Landscapes in this Lane are frozen. ;Lemon Grab Vs Gunter;glacier_racer.png;1;2;6
Glorious Gramophone;Spell;Blue Plains;Draw 4 cards, then discard any 2 cards. ;Fionna Vs Cake;glorious_gramophone.png;1;;
Gnome Snot;Spell;Blue Plains;Draw 3 cards. ;Finn Vs Jake;gnome_snot.png;1;;
Gnome Snot Manufacturing Facility;Building;Useless Swamp;When you would spend an Action to draw a card, draw an additional card. (While your hand has less cards than your opponent's, reduce the cost to play this building by 1 for every additional card.);Custom Community Cards;gnome_snot_manufacturing_facility.png;3;;
Goat;Creature;Rainbow;If Goat replaces a Creature, draw a card. ;Princess Bubblegum Vs Lumpy Space Princess;goat.png;0;1;4
Gold Ninja;Creature;Cornfield;When Gold Ninja enters play, deal 1 damage to target Creature for each different Landscape type you control. ;For The Glory;gold_ninja.png;1;2;6
Golden Axe Stump;Creature;SandyLands;Whenever an opponent draws a card, deal 1 damage to that player. ;For The Glory;golden_axe_stump.png;1;1;7
Golden Jackal;Creature;Cornfield;FLOOP and discard a SandyLands card >>> Deal 1 damage to each opposing Creature. ;For The Glory;golden_jackal.png;1;1;4
Gossamer Beam;Spell;Useless Swamp;Target opponent discards a card. You may return a Creature from your discard pile to your hand. ;Prismo Vs The Lich;gossamer_beam.png;1;;
Gracious Armourdillo;Creature;NiceLands;Whump. When an opposing Creature attacks, you may choose to have it attack Gracious Armourdillo instead. ;Flame Princess Vs Fern;gracious_armourdillo.png;4;4;16
Granary Weevil;Creature;Useless Swamp;Destroy Granary Weevil >>> Destroy target opposing Creature in this Lane and any Creature with the same name in play. ;Doubles Tournament;granary_weevil.png;2;2;6
Grand Mummy;Creature;SandyLands;At the start of your turn, you may return Grand Mummy to its owner's hand. If you do, draw 2 cards. ;Lemon Grab Vs Gunter;grand_mummy.png;1;3;3
Grand Prix;Hero;;Once during your turn, you may put a Creature you played this turn back into your hand, then play it for free and put 3 damage on it. ;Doubles Tournament;grand_prix.png;;;
Grape Butt;Spell;Cornfield;Play only if you played a non-Cornfield card this turn. Deal S damage to target Creature. ;For The Glory;grape_butt.png;1;;
